{
  "version": "1.0",
  "title": "Tiny Piano Check",
  "description": "A five-second pure instrumental piano sketch for API smoke testing.",
  "duration_seconds": 5,
  "tempo_bpm": 96,
  "key": "C major",
  "time_signature": "4/4",
  "ticks_per_beat": 480,
  "total_beats": 8,
  "style": "simple piano",
  "mood": [
    "calm",
    "clean"
  ],
  "chord_progression": [
    "C",
    "G",
    "Am",
    "F"
  ],
  "tracks": [
    {
      "name": "Piano Melody",
      "role": "main melody",
      "instrument": "acoustic grand piano",
      "channel": 0,
      "program": 0,
      "is_drum": false,
      "notes": [
        {
          "pitch": 60,
          "start": 0,
          "duration": 1,
          "velocity": 76
        },
        {
          "pitch": 64,
          "start": 1,
          "duration": 1,
          "velocity": 72
        },
        {
          "pitch": 67,
          "start": 2,
          "duration": 1,
          "velocity": 74
        },
        {
          "pitch": 72,
          "start": 3,
          "duration": 1,
          "velocity": 78
        },
        {
          "pitch": 69,
          "start": 4,
          "duration": 1,
          "velocity": 72
        },
        {
          "pitch": 67,
          "start": 5,
          "duration": 1,
          "velocity": 70
        },
        {
          "pitch": 64,
          "start": 6,
          "duration": 1,
          "velocity": 68
        },
        {
          "pitch": 60,
          "start": 7,
          "duration": 1,
          "velocity": 74
        }
      ]
    },
    {
      "name": "Piano Harmony",
      "role": "soft chord support",
      "instrument": "acoustic grand piano",
      "channel": 1,
      "program": 0,
      "is_drum": false,
      "notes": [
        {
          "pitch": 48,
          "start": 0,
          "duration": 2,
          "velocity": 54
        },
        {
          "pitch": 52,
          "start": 0,
          "duration": 2,
          "velocity": 50
        },
        {
          "pitch": 55,
          "start": 0,
          "duration": 2,
          "velocity": 52
        },
        {
          "pitch": 43,
          "start": 2,
          "duration": 2,
          "velocity": 52
        },
        {
          "pitch": 47,
          "start": 2,
          "duration": 2,
          "velocity": 48
        },
        {
          "pitch": 50,
          "start": 2,
          "duration": 2,
          "velocity": 50
        },
        {
          "pitch": 45,
          "start": 4,
          "duration": 2,
          "velocity": 52
        },
        {
          "pitch": 48,
          "start": 4,
          "duration": 2,
          "velocity": 48
        },
        {
          "pitch": 52,
          "start": 4,
          "duration": 2,
          "velocity": 50
        },
        {
          "pitch": 41,
          "start": 6,
          "duration": 2,
          "velocity": 54
        },
        {
          "pitch": 45,
          "start": 6,
          "duration": 2,
          "velocity": 50
        },
        {
          "pitch": 48,
          "start": 6,
          "duration": 2,
          "velocity": 52
        }
      ]
    }
  ]
}
