{
  "version": "1.0",
  "title": "Boss Battle Pulse",
  "description": "A simple 30-second pure instrumental boss battle cue with lead synth, pad, bass, and drums.",
  "duration_seconds": 30,
  "tempo_bpm": 120,
  "key": "D minor",
  "time_signature": "4/4",
  "ticks_per_beat": 480,
  "total_beats": 60,
  "style": "game battle",
  "mood": [
    "tense",
    "energetic"
  ],
  "chord_progression": [
    "Dm",
    "Bb",
    "F",
    "C"
  ],
  "tracks": [
    {
      "name": "Lead Synth",
      "role": "main melody",
      "instrument": "lead synth",
      "channel": 0,
      "program": 81,
      "is_drum": false,
      "notes": [
        {"pitch": 74, "start": 0, "duration": 0.75, "velocity": 88},
        {"pitch": 72, "start": 1, "duration": 0.75, "velocity": 76},
        {"pitch": 69, "start": 2, "duration": 0.75, "velocity": 80},
        {"pitch": 72, "start": 3, "duration": 0.75, "velocity": 82},
        {"pitch": 77, "start": 4, "duration": 0.75, "velocity": 90},
        {"pitch": 76, "start": 5, "duration": 0.75, "velocity": 78},
        {"pitch": 72, "start": 6, "duration": 0.75, "velocity": 82},
        {"pitch": 69, "start": 7, "duration": 0.75, "velocity": 80},
        {"pitch": 74, "start": 8, "duration": 0.75, "velocity": 88},
        {"pitch": 72, "start": 9, "duration": 0.75, "velocity": 76},
        {"pitch": 69, "start": 10, "duration": 0.75, "velocity": 80},
        {"pitch": 67, "start": 11, "duration": 0.75, "velocity": 82},
        {"pitch": 69, "start": 12, "duration": 0.75, "velocity": 86},
        {"pitch": 72, "start": 13, "duration": 0.75, "velocity": 90},
        {"pitch": 74, "start": 14, "duration": 1.5, "velocity": 92},
        {"pitch": 86, "start": 16, "duration": 0.75, "velocity": 92},
        {"pitch": 84, "start": 17, "duration": 0.75, "velocity": 82},
        {"pitch": 81, "start": 18, "duration": 0.75, "velocity": 86},
        {"pitch": 84, "start": 19, "duration": 0.75, "velocity": 88},
        {"pitch": 89, "start": 20, "duration": 0.75, "velocity": 94},
        {"pitch": 88, "start": 21, "duration": 0.75, "velocity": 84},
        {"pitch": 84, "start": 22, "duration": 0.75, "velocity": 86},
        {"pitch": 81, "start": 23, "duration": 0.75, "velocity": 84},
        {"pitch": 86, "start": 24, "duration": 0.75, "velocity": 94},
        {"pitch": 89, "start": 25, "duration": 0.75, "velocity": 96},
        {"pitch": 93, "start": 26, "duration": 0.75, "velocity": 98},
        {"pitch": 89, "start": 27, "duration": 0.75, "velocity": 88},
        {"pitch": 86, "start": 28, "duration": 1.75, "velocity": 96}
      ]
    },
    {
      "name": "Dark Pad",
      "role": "harmony",
      "instrument": "synth pad",
      "channel": 1,
      "program": 89,
      "is_drum": false,
      "notes": [
        {"pitch": 50, "start": 0, "duration": 4, "velocity": 56},
        {"pitch": 57, "start": 0, "duration": 4, "velocity": 52},
        {"pitch": 62, "start": 0, "duration": 4, "velocity": 54},
        {"pitch": 46, "start": 4, "duration": 4, "velocity": 54},
        {"pitch": 53, "start": 4, "duration": 4, "velocity": 50},
        {"pitch": 58, "start": 4, "duration": 4, "velocity": 52},
        {"pitch": 41, "start": 8, "duration": 4, "velocity": 54},
        {"pitch": 48, "start": 8, "duration": 4, "velocity": 50},
        {"pitch": 53, "start": 8, "duration": 4, "velocity": 52},
        {"pitch": 48, "start": 12, "duration": 4, "velocity": 56},
        {"pitch": 55, "start": 12, "duration": 4, "velocity": 52},
        {"pitch": 60, "start": 12, "duration": 4, "velocity": 54},
        {"pitch": 50, "start": 16, "duration": 4, "velocity": 58},
        {"pitch": 57, "start": 16, "duration": 4, "velocity": 54},
        {"pitch": 62, "start": 16, "duration": 4, "velocity": 56},
        {"pitch": 46, "start": 20, "duration": 4, "velocity": 56},
        {"pitch": 53, "start": 20, "duration": 4, "velocity": 52},
        {"pitch": 58, "start": 20, "duration": 4, "velocity": 54},
        {"pitch": 41, "start": 24, "duration": 4, "velocity": 56},
        {"pitch": 48, "start": 24, "duration": 4, "velocity": 52},
        {"pitch": 53, "start": 24, "duration": 4, "velocity": 54},
        {"pitch": 50, "start": 28, "duration": 2, "velocity": 60},
        {"pitch": 57, "start": 28, "duration": 2, "velocity": 56},
        {"pitch": 62, "start": 28, "duration": 2, "velocity": 58}
      ]
    },
    {
      "name": "Bass",
      "role": "low foundation",
      "instrument": "electric bass",
      "channel": 2,
      "program": 38,
      "is_drum": false,
      "notes": [
        {"pitch": 38, "start": 0, "duration": 1.5, "velocity": 84},
        {"pitch": 38, "start": 2, "duration": 1.5, "velocity": 76},
        {"pitch": 34, "start": 4, "duration": 1.5, "velocity": 82},
        {"pitch": 34, "start": 6, "duration": 1.5, "velocity": 74},
        {"pitch": 41, "start": 8, "duration": 1.5, "velocity": 82},
        {"pitch": 41, "start": 10, "duration": 1.5, "velocity": 74},
        {"pitch": 36, "start": 12, "duration": 1.5, "velocity": 84},
        {"pitch": 36, "start": 14, "duration": 1.5, "velocity": 76},
        {"pitch": 38, "start": 16, "duration": 1.5, "velocity": 88},
        {"pitch": 38, "start": 18, "duration": 1.5, "velocity": 78},
        {"pitch": 34, "start": 20, "duration": 1.5, "velocity": 86},
        {"pitch": 34, "start": 22, "duration": 1.5, "velocity": 76},
        {"pitch": 41, "start": 24, "duration": 1.5, "velocity": 86},
        {"pitch": 41, "start": 26, "duration": 1.5, "velocity": 78},
        {"pitch": 38, "start": 28, "duration": 2, "velocity": 90}
      ]
    },
    {
      "name": "Drums",
      "role": "simple battle groove",
      "instrument": "standard drum kit",
      "channel": 9,
      "program": 0,
      "is_drum": true,
      "notes": [
        {"pitch": 36, "start": 0, "duration": 0.1, "velocity": 94},
        {"pitch": 38, "start": 1, "duration": 0.1, "velocity": 72},
        {"pitch": 36, "start": 2, "duration": 0.1, "velocity": 82},
        {"pitch": 38, "start": 3, "duration": 0.1, "velocity": 76},
        {"pitch": 36, "start": 4, "duration": 0.1, "velocity": 94},
        {"pitch": 38, "start": 5, "duration": 0.1, "velocity": 72},
        {"pitch": 36, "start": 6, "duration": 0.1, "velocity": 82},
        {"pitch": 49, "start": 7, "duration": 0.1, "velocity": 80},
        {"pitch": 36, "start": 8, "duration": 0.1, "velocity": 96},
        {"pitch": 38, "start": 9, "duration": 0.1, "velocity": 74},
        {"pitch": 36, "start": 10, "duration": 0.1, "velocity": 84},
        {"pitch": 38, "start": 11, "duration": 0.1, "velocity": 78},
        {"pitch": 36, "start": 12, "duration": 0.1, "velocity": 96},
        {"pitch": 38, "start": 13, "duration": 0.1, "velocity": 74},
        {"pitch": 36, "start": 14, "duration": 0.1, "velocity": 86},
        {"pitch": 49, "start": 15, "duration": 0.1, "velocity": 84},
        {"pitch": 36, "start": 16, "duration": 0.1, "velocity": 98},
        {"pitch": 38, "start": 17, "duration": 0.1, "velocity": 76},
        {"pitch": 36, "start": 18, "duration": 0.1, "velocity": 88},
        {"pitch": 38, "start": 19, "duration": 0.1, "velocity": 80},
        {"pitch": 36, "start": 20, "duration": 0.1, "velocity": 98},
        {"pitch": 38, "start": 21, "duration": 0.1, "velocity": 76},
        {"pitch": 36, "start": 22, "duration": 0.1, "velocity": 88},
        {"pitch": 49, "start": 23, "duration": 0.1, "velocity": 86},
        {"pitch": 36, "start": 24, "duration": 0.1, "velocity": 100},
        {"pitch": 38, "start": 25, "duration": 0.1, "velocity": 78},
        {"pitch": 36, "start": 26, "duration": 0.1, "velocity": 90},
        {"pitch": 38, "start": 27, "duration": 0.1, "velocity": 82},
        {"pitch": 36, "start": 28, "duration": 0.1, "velocity": 104},
        {"pitch": 49, "start": 29, "duration": 0.1, "velocity": 90}
      ]
    }
  ]
}
